[
  {
    "rental_id": "CT-CR-001",
    "company": "Contoso Wheels",
    "city": "Paris",
    "car_type": "Economy",
    "price_per_day_usd": "45.00",
    "available": "true",
    "pickup_date": "2025-08-15",
    "return_date": "2025-08-30"
  },
  {
    "rental_id": "CT-CR-002",
    "company": "Contoso Wheels",
    "city": "Paris",
    "car_type": "SUV",
    "price_per_day_usd": "85.00",
    "available": "true",
    "pickup_date": "2025-08-15",
    "return_date": "2025-08-30"
  },
  {
    "rental_id": "CT-CR-003",
    "company": "EuroDrive",
    "city": "Paris",
    "car_type": "Luxury",
    "price_per_day_usd": "150.00",
    "available": "true",
    "pickup_date": "2025-08-15",
    "return_date": "2025-08-30"
  },
  {
    "rental_id": "CT-CR-004",
    "company": "Contoso Wheels",
    "city": "London",
    "car_type": "Economy",
    "price_per_day_usd": "50.00",
    "available": "true",
    "pickup_date": "2025-09-01",
    "return_date": "2025-09-15"
  },
  {
    "rental_id": "CT-CR-005",
    "company": "Contoso Wheels",
    "city": "London",
    "car_type": "SUV",
    "price_per_day_usd": "95.00",
    "available": "true",
    "pickup_date": "2025-09-01",
    "return_date": "2025-09-15"
  },
  {
    "rental_id": "CT-CR-006",
    "company": "BritCars",
    "city": "London",
    "car_type": "Luxury",
    "price_per_day_usd": "175.00",
    "available": "false",
    "pickup_date": "2025-09-01",
    "return_date": "2025-09-15"
  },
  {
    "rental_id": "CT-CR-007",
    "company": "Contoso Wheels",
    "city": "Tokyo",
    "car_type": "Economy",
    "price_per_day_usd": "55.00",
    "available": "true",
    "pickup_date": "2025-10-05",
    "return_date": "2025-10-20"
  },
  {
    "rental_id": "CT-CR-008",
    "company": "NipponRide",
    "city": "Tokyo",
    "car_type": "Minivan",
    "price_per_day_usd": "90.00",
    "available": "true",
    "pickup_date": "2025-10-05",
    "return_date": "2025-10-20"
  },
  {
    "rental_id": "CT-CR-009",
    "company": "NipponRide",
    "city": "Tokyo",
    "car_type": "Luxury",
    "price_per_day_usd": "200.00",
    "available": "true",
    "pickup_date": "2025-10-05",
    "return_date": "2025-10-20"
  },
  {
    "rental_id": "CT-CR-010",
    "company": "Contoso Wheels",
    "city": "Rome",
    "car_type": "Economy",
    "price_per_day_usd": "40.00",
    "available": "true",
    "pickup_date": "2025-11-01",
    "return_date": "2025-11-15"
  },
  {
    "rental_id": "CT-CR-011",
    "company": "ItaliaWheels",
    "city": "Rome",
    "car_type": "SUV",
    "price_per_day_usd": "80.00",
    "available": "true",
    "pickup_date": "2025-11-01",
    "return_date": "2025-11-15"
  },
  {
    "rental_id": "CT-CR-012",
    "company": "ItaliaWheels",
    "city": "Rome",
    "car_type": "Luxury",
    "price_per_day_usd": "160.00",
    "available": "false",
    "pickup_date": "2025-11-01",
    "return_date": "2025-11-15"
  },
  {
    "rental_id": "CT-CR-013",
    "company": "Contoso Wheels",
    "city": "Canc\u00fan",
    "car_type": "Economy",
    "price_per_day_usd": "35.00",
    "available": "true",
    "pickup_date": "2025-12-20",
    "return_date": "2026-01-05"
  },
  {
    "rental_id": "CT-CR-014",
    "company": "SolRentals",
    "city": "Canc\u00fan",
    "car_type": "SUV",
    "price_per_day_usd": "70.00",
    "available": "true",
    "pickup_date": "2025-12-20",
    "return_date": "2026-01-05"
  },
  {
    "rental_id": "CT-CR-015",
    "company": "SolRentals",
    "city": "Canc\u00fan",
    "car_type": "Minivan",
    "price_per_day_usd": "65.00",
    "available": "true",
    "pickup_date": "2025-12-20",
    "return_date": "2026-01-05"
  }
]
